{
  "$schema": "https://json-schema.org/draft/2020-12/schema",
  "title": "Step",
  "description": "One node of a process graph. Every step carries its method, the reason for the choice, the alternatives rejected, its exactness class and, for any method that can vary, a fallback. Two rules from ADR-0014 and ADR-0004 are enforced here: a step classed exact takes its result from rule or statistics only, and a step on llm or worker names a fallback. A step on ml or neural pins its model version, because that is what makes it reproducible.",
  "type": "object",
  "properties": {
    "id": {
      "description": "Stable name of the step inside its process, lowercase with hyphens.",
      "type": "string",
      "pattern": "^[a-z][a-z0-9-]*$"
    },
    "method": { "$ref": "method.schema.json" },
    "reason": {
      "description": "Why this method was chosen for this step.",
      "type": "string",
      "minLength": 1
    },
    "rejected": {
      "description": "The alternatives considered and why they were not chosen. Empty when there was nothing to reject.",
      "type": "array",
      "items": {
        "type": "object",
        "properties": {
          "method": { "$ref": "method.schema.json" },
          "why": { "type": "string", "minLength": 1 }
        },
        "required": ["method", "why"],
        "additionalProperties": false
      }
    },
    "exactness": { "$ref": "exactness-class.schema.json" },
    "fallback": {
      "description": "Where the step goes when the chosen method is not good enough. Mandatory for llm and worker.",
      "type": "object",
      "properties": {
        "when": {
          "description": "The condition that triggers the fallback, stated so that it can be evaluated: confidence < 0.9, tests failed twice.",
          "type": "string",
          "minLength": 1
        },
        "to": { "$ref": "method.schema.json" }
      },
      "required": ["when", "to"],
      "additionalProperties": false
    },
    "model": {
      "description": "The model this step runs on, pinned as name@version. Required for ml and neural.",
      "type": "string",
      "pattern": "^[a-z0-9][a-z0-9._-]*@[A-Za-z0-9][A-Za-z0-9._+-]*$"
    },
    "requires": {
      "description": "Capabilities the executing adapter must offer. Never a product name.",
      "type": "array",
      "items": { "$ref": "capability.schema.json" },
      "uniqueItems": true
    },
    "depends_on": {
      "description": "Steps of the same process that must finish before this one starts. The edges of the graph.",
      "type": "array",
      "items": { "type": "string", "pattern": "^[a-z][a-z0-9-]*$" },
      "uniqueItems": true
    }
  },
  "required": ["id", "method", "reason", "rejected", "exactness"],
  "additionalProperties": false,
  "allOf": [
    {
      "if": { "properties": { "method": { "$ref": "method.schema.json#/$defs/variable" } } },
      "then": { "required": ["fallback"] }
    },
    {
      "if": { "properties": { "method": { "$ref": "method.schema.json#/$defs/pinned" } } },
      "then": { "required": ["model"] }
    },
    {
      "if": { "properties": { "exactness": { "const": "exact" } } },
      "then": { "properties": { "method": { "$ref": "method.schema.json#/$defs/exactAdmissible" } } }
    }
  ]
}
