{
  "id": "draft-release-notes",
  "method": "llm",
  "reason": "free text from a changelog; variation is wanted",
  "rejected": [
    {
      "method": "rule",
      "why": "a template reads as a template"
    }
  ],
  "exactness": "free",
  "fallback": {
    "when": "two drafts rejected by the reviewer",
    "to": "human"
  },
  "requires": [
    "vcs.read"
  ]
}
